[
  {
    "id": "a-spread-of-rampant-green",
    "name": "A Spread of Rampant Green",
    "title": "Green",
    "set": "base",
    "complexity": 2,
    "emote": "<:SpiritSpreadRampantGreen:852365959149912095>",
    "aliases": [],
    "uniques": [
      "fields_choked_with_growth",
      "stem_the_flow_of_fresh_water",
      "gift_of_proliferation",
      "overgrow_in_a_night"
    ],
    "panel": [
      "https://cdn.callofthedahanways.com/spirits/a-spread-of-rampant-green/panel-1.jpg",
      "https://cdn.callofthedahanways.com/spirits/a-spread-of-rampant-green/panel-2.jpg"
    ],
    "aspects": [
      {
        "id": "a-spread-of-rampant-green/regrowth",
        "name": "Regrowth",
        "emote": "<:DestroyedPresence:1386717215302353037>",
        "panel": [
          "https://cdn.callofthedahanways.com/spirits/a-spread-of-rampant-green/aspects/regrowth/panel-1.jpg"
        ]
      },
      {
        "id": "a-spread-of-rampant-green/tangles",
        "name": "Tangles",
        "emote": "<:TokenWilds:852366051832102993>",
        "panel": [
          "https://cdn.callofthedahanways.com/spirits/a-spread-of-rampant-green/aspects/tangles/panel-1.jpg",
          "https://cdn.callofthedahanways.com/spirits/a-spread-of-rampant-green/aspects/tangles/panel-2.jpg"
        ]
      }
    ]
  },
  {
    "id": "bringer-of-dreams-and-nightmares",
    "name": "Bringer of Dreams and Nightmares",
    "title": "BoDaN",
    "set": "base",
    "complexity": 3,
    "emote": "<:SpiritBodanBringerDreamsNightmar:852365960370454528>",
    "aliases": ["bodan"],
    "uniques": [
      "call_on_midnights_dream",
      "dreams_of_the_dahan",
      "predatory_nightmares",
      "dread_apparitions"
    ],
    "panel": [
      "https://cdn.callofthedahanways.com/spirits/bringer-of-dreams-and-nightmares/panel-1.jpg",
      "https://cdn.callofthedahanways.com/spirits/bringer-of-dreams-and-nightmares/panel-2.jpg"
    ],
    "aspects": [
      {
        "id": "bringer-of-dreams-and-nightmares/enticing",
        "name": "Enticing",
        "emote": "🧲",
        "panel": [
          "https://cdn.callofthedahanways.com/spirits/bringer-of-dreams-and-nightmares/aspects/enticing/panel-1.jpg"
        ]
      },
      {
        "id": "bringer-of-dreams-and-nightmares/violence",
        "name": "Violence",
        "emote": "⚔️",
        "panel": [
          "https://cdn.callofthedahanways.com/spirits/bringer-of-dreams-and-nightmares/aspects/violence/panel-1.jpg"
        ]
      }
    ]
  },
  {
    "id": "downpour-drenches-the-world",
    "name": "Downpour Drenches the World",
    "title": "Downpour",
    "set": "f&f",
    "complexity": 3,
    "emote": "<:SpiritDownpourDrenchesWorld:852365957744689153>",
    "aliases": ["bird"],
    "uniques": [
      "unbearable_deluge",
      "foundations_sink_into_mud",
      "gift_of_abundance",
      "dark_skies_loose_a_stinging_rain"
    ],
    "panel": [
      "https://cdn.callofthedahanways.com/spirits/downpour-drenches-the-world/panel-1.jpg",
      "https://cdn.callofthedahanways.com/spirits/downpour-drenches-the-world/panel-2.jpg"
    ],
    "aspects": []
  },
  {
    "id": "finder-of-paths-unseen",
    "name": "Finder of Paths Unseen",
    "title": "Finder",
    "set": "f&f",
    "complexity": 4,
    "emote": "<:SpiritFinderPathsUnseen:852365960236236811>",
    "aliases": ["bird"],
    "uniques": [
      "travelers_boon",
      "paths_tied_by_nature",
      "a_circuitous_and_wending_journey",
      "offer_passage_between_worlds",
      "ways_of_shore_and_heartland",
      "aid_from_the_spiritspeakers"
    ],
    "panel": [
      "https://cdn.callofthedahanways.com/spirits/finder-of-paths-unseen/panel-1.jpg",
      "https://cdn.callofthedahanways.com/spirits/finder-of-paths-unseen/panel-2.jpg"
    ],
    "aspects": []
  },
  {
    "id": "fractured-days-split-the-sky",
    "name": "Fractured Days Split the Sky",
    "title": "Fractured",
    "set": "je",
    "complexity": 4,
    "emote": "<:SpiritFracturedDaysSplitSky:852365961800712252>",
    "aliases": [],
    "uniques": [
      "the_past_returns_again",
      "absolute_stasis",
      "pour_time_sideways",
      "blur_the_arc_of_years"
    ],
    "panel": [
      "https://cdn.callofthedahanways.com/spirits/fractured-days-split-the-sky/panel-1.jpg",
      "https://cdn.callofthedahanways.com/spirits/fractured-days-split-the-sky/panel-2.jpg"
    ],
    "aspects": []
  },
  {
    "id": "grinning-trickster-stirs-up-trouble",
    "name": "Grinning Trickster Stirs Up Trouble",
    "title": "Trickster",
    "set": "je",
    "complexity": 2,
    "emote": "<:SpiritGrinningTrickster:1182312575988416583>",
    "aliases": [],
    "uniques": [
      "unexpected_tigers",
      "impersonate_authority",
      "incite_the_mob",
      "overenthusiastic_arson"
    ],
    "panel": [
      "https://cdn.callofthedahanways.com/spirits/grinning-trickster-stirs-up-trouble/panel-1.jpg",
      "https://cdn.callofthedahanways.com/spirits/grinning-trickster-stirs-up-trouble/panel-2.jpg"
    ],
    "aspects": []
  },
  {
    "id": "heart-of-the-wildfire",
    "name": "Heart of the Wildfire",
    "title": "Wildfire",
    "set": "f&f",
    "complexity": 3,
    "emote": "<:SpiritHeartWildfire:852365962286989343>",
    "aliases": [],
    "uniques": [
      "flames_fury",
      "threatening_flames",
      "flashfires",
      "asphyxiating_smoke"
    ],
    "panel": [
      "https://cdn.callofthedahanways.com/spirits/heart-of-the-wildfire/panel-1.jpg",
      "https://cdn.callofthedahanways.com/spirits/heart-of-the-wildfire/panel-2.jpg"
    ],
    "aspects": [
      {
        "id": "heart-of-the-wildfire/transforming",
        "name": "Transforming",
        "emote": "🏳️‍⚧️",
        "panel": [
          "https://cdn.callofthedahanways.com/spirits/heart-of-the-wildfire/aspects/transforming/panel-1.jpg"
        ]
      }
    ]
  },
  {
    "id": "keeper-of-the-forbidden-wilds",
    "name": "Keeper of the Forbidden Wilds",
    "title": "Keeper",
    "set": "b&c",
    "complexity": 2,
    "emote": "<:SpiritKeeperForbiddenWilds:852365961420210216>",
    "aliases": [],
    "uniques": [
      "regrow_from_roots",
      "boon_of_growing_power",
      "sacrosanct_wilderness",
      "towering_wrath"
    ],
    "panel": [
      "https://cdn.callofthedahanways.com/spirits/keeper-of-the-forbidden-wilds/panel-1.jpg",
      "https://cdn.callofthedahanways.com/spirits/keeper-of-the-forbidden-wilds/panel-2.jpg"
    ],
    "aspects": [
      {
        "id": "keeper-of-the-forbidden-wilds/spreading-hostility",
        "name": "Spreading Hostility",
        "emote": "<:TokenBadlands:852366051454746665>",
        "panel": [
          "https://cdn.callofthedahanways.com/spirits/keeper-of-the-forbidden-wilds/aspects/spreading-hostility/panel-1.jpg"
        ]
      }
    ]
  },
  {
    "id": "lightnings-swift-strike",
    "name": "Lightning's Swift Strike",
    "title": "Lightning",
    "set": "base",
    "complexity": 1,
    "emote": "<:SpiritLightningSwiftStrike:852365958839664691>",
    "aliases": ["bird"],
    "uniques": [
      "harbingers_of_the_lightning",
      "lightnings_boon",
      "shatter_homesteads",
      "raging_storm"
    ],
    "panel": [
      "https://cdn.callofthedahanways.com/spirits/lightnings-swift-strike/panel-1.jpg",
      "https://cdn.callofthedahanways.com/spirits/lightnings-swift-strike/panel-2.jpg"
    ],
    "powerProgression": "https://cdn.callofthedahanways.com/spirits/lightnings-swift-strike/power-progression.jpg",
    "aspects": [
      {
        "id": "lightnings-swift-strike/pandemonium",
        "name": "Pandemonium",
        "emote": "🐼",
        "panel": [
          "https://cdn.callofthedahanways.com/spirits/lightnings-swift-strike/aspects/pandemonium/panel-1.jpg"
        ]
      },
      {
        "id": "lightnings-swift-strike/wind",
        "name": "Wind",
        "emote": "<:EAir:852604219210727434>",
        "panel": [
          "https://cdn.callofthedahanways.com/spirits/lightnings-swift-strike/aspects/wind/panel-1.jpg"
        ]
      },
      {
        "id": "lightnings-swift-strike/immense",
        "name": "Immense",
        "emote": "<:Major:1386718312876216451>",
        "panel": [
          "https://cdn.callofthedahanways.com/spirits/lightnings-swift-strike/aspects/immense/panel-1.jpg"
        ]
      },
      {
        "id": "lightnings-swift-strike/sparking",
        "name": "Sparking",
        "emote": "✨",
        "panel": [
          "https://cdn.callofthedahanways.com/spirits/lightnings-swift-strike/aspects/sparking/panel-1.jpg",
          "https://cdn.callofthedahanways.com/spirits/lightnings-swift-strike/aspects/sparking/panel-2.jpg"
        ]
      }
    ]
  },
  {
    "id": "lure-of-the-deep-wilderness",
    "name": "Lure of the Deep Wilderness",
    "title": "Lure",
    "set": "je",
    "complexity": 2,
    "emote": "<:SpiritLureDeepWilderness:852365959237992458>",
    "aliases": [],
    "uniques": [
      "gift_of_the_untamed_wild",
      "perils_of_the_deepest_island",
      "swallowed_by_the_wilderness",
      "softly_beckon_ever_inward"
    ],
    "panel": [
      "https://cdn.callofthedahanways.com/spirits/lure-of-the-deep-wilderness/panel-1.jpg",
      "https://cdn.callofthedahanways.com/spirits/lure-of-the-deep-wilderness/panel-2.jpg"
    ],
    "aspects": [
      {
        "id": "lure-of-the-deep-wilderness/lair",
        "name": "Lair",
        "emote": "<:IncarnaLair:1386717472102682784>",
        "panel": [
          "https://cdn.callofthedahanways.com/spirits/lure-of-the-deep-wilderness/aspects/lair/panel-1.jpg"
        ],
        "incarna": {
          "aliases": [],
          "panel": ["https://imgur.com/VMuYUo4"]
        }
      }
    ]
  },
  {
    "id": "many-minds-move-as-one",
    "name": "Many Minds Move as One",
    "title": "ManyMinds",
    "set": "je",
    "complexity": 2,
    "emote": "<:SpiritManyMindsMoveOne:852365959334854666>",
    "aliases": ["bird"],
    "uniques": [
      "pursue_with_scratches_pecks_and_stings",